Equipment,Muscle,Exercise,Instructions
Pull-up Bar,Back,Negative Pull-up,"Grip the pull-up bar with your palms facing away from you. Jump or use a bench to get your chin above the bar. Slowly lower your body down to a fully extended position. This exercise emphasizes the eccentric phase of the pull-up, building strength in the back and biceps."
Pull-up Bar,Back,Lat Pulldown,"Sit at a lat pulldown machine with a wide grip on the bar. Pull the bar down toward your chest, squeezing your shoulder blades together at the bottom of the movement. Slowly return the bar to the starting position. This exercise targets the lats and upper back."
Pull-up Bar,Shoulders,Pull-up,"Grip the pull-up bar with your palms facing away from you. Hang with your arms fully extended, then pull your chest up toward the bar. Lower your body back down with control. This exercise targets the shoulders, traps, lats, and biceps."
Resistance Bands,Full Body,Band Squat,"Stand with your feet shoulder-width apart, holding the handles of the resistance band with both hands. Position the band under your feet and hold the handles at shoulder height. Squat down, pushing your hips back and bending your knees. Push through your heels to stand back up. This exercise targets the quads, hamstrings, and glutes."
Resistance Bands,Full Body,Banded Push-up,"Start in a push-up position with the resistance band placed across your upper back and anchored at both ends under your hands. Perform a standard push-up, keeping your body straight and lowering your chest to the floor, then press back up. This exercise targets the chest, triceps, and shoulders."
Resistance Bands,Full Body,Band Thruster,"Stand with your feet shoulder-width apart, holding the resistance band handles at shoulder height. Perform a squat and, as you rise, press the handles overhead into a full extension. Lower the band back to the starting position and repeat. This exercise targets the legs, shoulders, and core."
Resistance Bands,Full Body,Band Pull-apart,"Hold a resistance band with both hands, arms extended in front of you. Pull the band apart by separating your hands while keeping your arms straight. Squeeze your shoulder blades together as you pull. Slowly return to the starting position. This exercise targets the back, shoulders, and traps."
Resistance Bands,Legs,Band Squat,"Stand with your feet shoulder-width apart and the resistance band looped around your thighs. Lower into a squat while pushing your knees outward against the resistance. Keep your chest lifted and push through your heels to stand back up. This exercise targets the glutes, quads, and hamstrings."
Resistance Bands,Legs,Band Lunge,"Place the resistance band under your front foot and hold the handles with both hands. Step forward into a lunge position, ensuring your knee stays aligned with your ankle. Push back to the starting position. This exercise targets the quads, hamstrings, and glutes."
Resistance Bands,Legs,Band Deadlift,"Place the resistance band under your feet and hold the handles. With a slight bend in your knees, hinge at the hips and lower the handles towards the ground. Squeeze your glutes and return to a standing position. This exercise targets the hamstrings, glutes, and lower back."
Resistance Bands,Legs,Banded Calf Raise,Place the resistance band under your feet and hold the handles. Stand tall and raise your heels off the ground by pushing through the balls of your feet. Lower your heels back down slowly. This exercise targets the calves.
Resistance Bands,Chest,Band Chest Press,Anchor the resistance band behind you at chest height. Hold the handles and position them at shoulder level with your elbows bent. Press the handles forward until your arms are fully extended. Slowly return to the starting position. This exercise targets the chest and triceps.
Resistance Bands,Chest,Band Flye,"Anchor the resistance band behind you and hold the handles. Start with your arms extended out to your sides and palms facing forward. Pull the handles together in front of you, squeezing your chest Muscles. Slowly return to the starting position. This exercise targets the chest."
Resistance Bands,Chest,Banded Push-up,"Place the resistance band across your upper back and perform a regular push-up. The band should add resistance as you push up, increasing the intensity. This exercise targets the chest, triceps, and shoulders."
Resistance Bands,Chest,Band Chest Squeeze,"Hold the resistance band with both hands in front of you, arms extended. Squeeze the handles together by contracting your chest Muscles. Slowly return to the starting position. This exercise targets the chest."
Resistance Bands,Back,Band Rows,"Anchor the resistance band at a low point in front of you. Hold the handles and pull them towards you, squeezing your shoulder blades together. Slowly return to the starting position. This exercise targets the back and biceps."
Resistance Bands,Back,Band Pull-apart,"Hold a resistance band with both hands, arms extended in front of you. Pull the band apart by separating your hands while keeping your arms straight. Squeeze your shoulder blades together as you pull. Slowly return to the starting position. This exercise targets the back, shoulders, and traps."
Resistance Bands,Back,Band Lat Pulldown,"Anchor the resistance band overhead and hold the handles. Pull the handles down towards your chest, keeping your elbows in line with your body. Slowly return to the starting position. This exercise targets the back, especially the lat Muscles."
Resistance Bands,Shoulders,Band Overhead Press,"Stand on the resistance band with your feet shoulder-width apart. Hold the handles at shoulder height with your palms facing forward. Press the handles overhead, extending your arms fully. Slowly return to the starting position. This exercise targets the shoulders."
Resistance Bands,Shoulders,Band Lateral Raise,Stand with your feet shoulder-width apart and hold the resistance band handles at your sides. Lift your arms straight out to the sides until they are shoulder-height. Slowly return to the starting position. This exercise targets the shoulders.
Resistance Bands,Shoulders,Band Front Raise,Stand with your feet shoulder-width apart and hold the resistance band handles in front of your thighs. Lift the handles in front of you until your arms are shoulder-height. Slowly return to the starting position. This exercise targets the front deltoids.
Kettlebell,Full Body,Kettlebell Swing,"Stand with your feet shoulder-width apart, holding the kettlebell with both hands. Hinge at the hips and swing the kettlebell between your legs, then drive your hips forward to swing it up to shoulder height. This exercise targets the hips, glutes, and core."
Kettlebell,Full Body,Goblet Squat,"Hold a kettlebell close to your chest with both hands, elbows pointing downward. Lower your body into a squat, keeping your chest up and back straight. Push through your heels to stand back up. This exercise targets the quads, glutes, and core."
Kettlebell,Full Body,Turkish Get-Up,"Lie on your back holding a kettlebell in one hand. Push the kettlebell overhead, keeping your arm straight. Slowly rise from the floor by moving through a series of positions (elbow, hand, hips) until you are standing. Reverse the movement to return to the floor. This exercise targets the core, shoulders, and hips."
Kettlebell,Full Body,Clean and Press,"Stand with your feet shoulder-width apart, holding the kettlebell with both hands. Clean the kettlebell to your chest, then press it overhead with one arm. Lower it back to the starting position. This exercise targets the shoulders, arms, and core."
Kettlebell,Full Body,Snatch,"Start with the kettlebell on the floor between your feet. Swing the kettlebell between your legs, then in one motion, pull it overhead, locking out your arm. Lower it back down with control and repeat. This exercise targets the hips, glutes, shoulders, and core."
Kettlebell,Core,Russian Twist,"Sit on the floor with your knees bent and feet flat. Hold a kettlebell with both hands, twisting your torso to each side, tapping the kettlebell to the floor. This exercise targets the obliques and core."
Kettlebell,Core,Windmill,"Hold a kettlebell overhead with one hand, keeping your arm straight. Hinge at your hips and lower your body while keeping the kettlebell overhead. Return to the starting position. This exercise targets the core and shoulders."
Kettlebell,Core,Around the World,"Hold a kettlebell with both hands in front of you. Rotate the kettlebell in a circular motion around your body, keeping your arms straight. This exercise targets the shoulders, core, and obliques."
Kettlebell,Core,Half Kneeling Halo,"Kneel on one knee while holding a kettlebell with both hands. Move the kettlebell in a circular motion around your head, keeping your core tight. This exercise targets the shoulders and core."
Kettlebell,Legs,Goblet Squat,"Hold a kettlebell close to your chest with both hands, elbows pointing downward. Lower your body into a squat, keeping your chest up and back straight. Push through your heels to stand back up. This exercise targets the quads, glutes, and core."
Kettlebell,Legs,Lunge Pass-through,"Hold a kettlebell in front of you with both hands. Step into a lunge, then pass the kettlebell under your front leg to your other hand. Return to standing and repeat with the other leg. This exercise targets the legs, glutes, and core."
Kettlebell,Legs,Single-leg Deadlift,"Hold a kettlebell in one hand. Stand on one leg and hinge forward at the hips, lowering the kettlebell towards the floor while keeping your back straight. Return to the standing position. This exercise targets the hamstrings, glutes, and core."
Kettlebell,Legs,Kettlebell Step-up,"Hold a kettlebell in both hands at chest height. Step up onto a bench or platform with one leg, then bring the other leg up to join it. Step back down and repeat. This exercise targets the quads, glutes, and hamstrings."
Kettlebell,Shoulders,Overhead Press,"Hold a kettlebell in one hand at shoulder height. Press the kettlebell overhead, keeping your arm straight. Lower the kettlebell back to the starting position. This exercise targets the shoulders and arms."
Kettlebell,Shoulders,Push Press,"Hold a kettlebell at shoulder height. Dip slightly by bending your knees, then press the kettlebell overhead using your legs for momentum. Lower it back down and repeat. This exercise targets the shoulders and arms."
Kettlebell,Shoulders,Halo,Hold the kettlebell with both hands and rotate it around your head in a circular motion. Keep your core engaged and focus on controlling the movement. This exercise targets the shoulders and core.
Kettlebell,Shoulders,Bottoms-up Press,"Hold the kettlebell upside down, with the bottom facing up. Press the kettlebell overhead while keeping it balanced. Lower it back down with control. This exercise targets the shoulders and stability."
Pull-up Bar,Upper Body,Pull-up,"Grip the pull-up bar with your palms facing away from you and hands shoulder-width apart. Pull your body up until your chin is above the bar, then lower yourself back down with control. This exercise targets the back, shoulders, and biceps."
Pull-up Bar,Upper Body,Chin-up,"Grip the pull-up bar with your palms facing towards you and hands shoulder-width apart. Pull your body up until your chin is above the bar, then lower yourself back down. This exercise targets the back, biceps, and forearms."
Pull-up Bar,Upper Body,Muscle-up,"Begin in a hanging position on the pull-up bar. Perform a pull-up and transition into a dip position by pushing your chest over the bar. Press up into a full dip, then reverse the movement. This advanced exercise targets the chest, shoulders, back, and arms."
Pull-up Bar,Upper Body,Wide Grip Pull-up,"Grip the pull-up bar with your hands wider than shoulder-width. Pull your body up until your chin is above the bar, then lower yourself back down with control. This exercise emphasizes the back and shoulders."
Pull-up Bar,Back,Pull-up,"Grip the pull-up bar with your palms facing away from you and hands shoulder-width apart. Pull your body up until your chin is above the bar, then lower yourself back down with control. This exercise targets the back and biceps."
Pull-up Bar,Back,Lat Pulldown,"Using a pull-up bar or lat pulldown machine, grip the bar with your palms facing away from you. Pull the bar down towards your chest while squeezing your shoulder blades together, then slowly return to the starting position. This exercise targets the lat Muscles."
Pull-up Bar,Back,Scapular Pull-up,Hang from the pull-up bar with your arms fully extended. Engage your shoulder blades and pull them down and back without bending your arms. This exercise isolates the Muscles around your scapula and improves shoulder mobility.
Pull-up Bar,Abs,Hanging Leg Raise,"Hang from the pull-up bar with your legs straight. Raise your legs towards your chest while keeping your body stable, then lower them back down with control. This exercise targets the lower abs."
Pull-up Bar,Abs,Toes-to-Bar,"Hang from the pull-up bar and raise your legs until your toes touch the bar. Lower your legs back down with control. This exercise targets the abs, especially the lower portion."
Pull-up Bar,Abs,Windshield Wiper,Hang from the pull-up bar with your legs extended. Rotate your legs side to side like windshield wipers while keeping your upper body stable. This exercise targets the obliques and core.
